{
  "$schema": "https://json-schema.org/draft/2020-12/schema",
  "$id": "https://funadmin.dev/schema/plugin.schema.json",
  "title": "FunAdmin Plugin Manifest",
  "type": "object",
  "additionalProperties": false,
  "required": ["schema_version", "code", "name", "version", "requires", "entry"],
  "$defs": {
    "path": { "type": "string", "minLength": 1, "pattern": "^(?!/)(?!.*(?:^|/)\\.\\.(?:/|$))(?!.*\\\\)(?!.*(?:^|/)\\.(?:/|$))[A-Za-z0-9._/-]+$" },
    "phpPath": { "allOf": [{ "$ref": "#/$defs/path" }, { "pattern": "\\.php$" }] },
    "sourcePath": { "allOf": [{ "$ref": "#/$defs/path" }, { "pattern": "\\.(?:vue|ts|tsx|js|jsx|css|scss|sass|less)$" }] },
    "resource": { "type": "object", "additionalProperties": false, "required": ["source", "target"], "properties": { "source": { "$ref": "#/$defs/path" }, "target": { "$ref": "#/$defs/path" } } },
    "permission": { "type": "object", "additionalProperties": false, "required": ["code", "name"], "properties": { "code": { "type": "string", "pattern": "^[a-z][a-z0-9]*:[a-z][a-z0-9-]*:[a-z][a-z0-9-]*$" }, "name": { "type": "string", "minLength": 1 } } },
    "menu": { "type": "object", "additionalProperties": false, "required": ["name", "path"], "properties": { "name": { "type": "string", "minLength": 1 }, "path": { "type": "string", "pattern": "^/plugin/[a-z][a-z0-9]*/[A-Za-z0-9/_-]+$" }, "permission": { "type": "string", "pattern": "^[a-z][a-z0-9]*:[a-z][a-z0-9-]*:[a-z][a-z0-9-]*$" } } },
    "adminRoute": { "type": "object", "additionalProperties": false, "required": ["path", "name", "component"], "properties": { "path": { "type": "string", "pattern": "^/plugin/[a-z][a-z0-9]*/[A-Za-z0-9/_-]+$" }, "name": { "type": "string", "pattern": "^[A-Za-z][A-Za-z0-9_]*$" }, "component": { "type": "string", "pattern": "^[A-Za-z][A-Za-z0-9_/-]*$" }, "meta": { "type": "object", "additionalProperties": false, "properties": { "title": { "type": "string" }, "icon": { "type": "string" }, "permission": { "type": "string", "pattern": "^[a-z][a-z0-9]*:[a-z][a-z0-9-]*:[a-z][a-z0-9-]*$" } } } } },
    "adminWeb": { "type": "object", "additionalProperties": false, "required": ["source", "components", "minFrontendVersion", "permissions", "menu", "routes"], "properties": { "source": { "$ref": "#/$defs/path" }, "components": { "type": "object", "minProperties": 1, "propertyNames": { "pattern": "^[A-Za-z][A-Za-z0-9_/-]*$" }, "additionalProperties": { "$ref": "#/$defs/sourcePath" } }, "minFrontendVersion": { "type": "string", "minLength": 1 }, "permissions": { "type": "array", "items": { "$ref": "#/$defs/permission" } }, "menu": { "type": "array", "items": { "$ref": "#/$defs/menu" } }, "routes": { "type": "array", "items": { "$ref": "#/$defs/adminRoute" } } } },
    "formComponent": { "type": "object", "additionalProperties": false, "required": ["type", "component", "propertySchema", "valueType", "defaultProps", "allowedEvents", "validator", "codec", "capabilityVersion"], "properties": { "type": { "type": "string", "pattern": "^[a-z][a-z0-9]*:[a-z][a-z0-9-]*$" }, "component": { "type": "string", "pattern": "^[A-Za-z][A-Za-z0-9_/-]*$" }, "propertySchema": { "type": "object" }, "valueType": { "type": "string", "enum": ["string", "number", "integer", "boolean", "array", "object", "mixed"] }, "defaultProps": { "type": "object" }, "allowedEvents": { "type": "array", "items": { "type": "string", "pattern": "^[a-z][A-Za-z0-9]*$" } }, "validator": { "type": "string", "pattern": "^[a-z][a-z0-9]*:[a-z][a-z0-9-]*$" }, "codec": { "type": "string", "pattern": "^[a-z][a-z0-9]*:[a-z][a-z0-9-]*$" }, "capabilityVersion": { "type": "integer", "minimum": 1 } } }
  },
  "properties": {
    "schema_version": { "const": 2 },
    "code": { "type": "string", "pattern": "^[a-z][a-z0-9]*$" },
    "name": { "type": "string", "minLength": 1, "maxLength": 250 },
    "description": { "type": "string" },
    "author": { "type": "string", "maxLength": 100 },
    "version": { "type": "string", "pattern": "^\\d+\\.\\d+\\.\\d+(?:[-+][0-9A-Za-z.-]+)?$" },
    "requires": { "type": "object", "additionalProperties": false, "required": ["plugins"], "properties": { "php": { "type": "string", "minLength": 1 }, "funadmin": { "type": "string", "minLength": 1 }, "plugins": { "type": "object", "propertyNames": { "pattern": "^[a-z][a-z0-9]*$" }, "additionalProperties": { "type": "string", "minLength": 1 } } } },
    "entry": { "type": "object", "additionalProperties": false, "required": ["class", "file"], "properties": { "class": { "type": "string", "pattern": "^plugins\\\\[a-z][a-z0-9]*\\\\Plugin$" }, "file": { "const": "Plugin.php" } } },
    "adminWeb": { "$ref": "#/$defs/adminWeb" },
    "formComponents": { "type": "array", "items": { "$ref": "#/$defs/formComponent" } },
    "resources": { "type": "object", "additionalProperties": false, "properties": { "public": { "$ref": "#/$defs/resource" } } },
    "migrations": { "type": "object", "additionalProperties": false, "required": ["path"], "properties": { "path": { "$ref": "#/$defs/path" } } },
    "storage": { "type": "object", "additionalProperties": false, "required": ["path"], "properties": { "path": { "$ref": "#/$defs/path" } } },
    "purge": { "type": "object", "additionalProperties": false, "required": ["supported"], "properties": { "supported": { "type": "boolean" } } }
  }
}
